{
  "contract_version":"1.0",
  "deck":{"name":"Semiconductor Startups 2026 Decision Brief","evidence_contract":"presentation-evidence.json","visual_contract":"visual-spec.json"},
  "claims":[
    {"id":"c1","text":"The ten companies cluster around four infrastructure bottlenecks rather than one GPU-replacement race.","kind":"interpretation","confidence":"high","evidence_ids":["e-crn","e-research"]},
    {"id":"c2","text":"Data movement, interconnect, and rack utilization increasingly determine useful AI throughput.","kind":"interpretation","confidence":"high","evidence_ids":["e-research"]},
    {"id":"c3","text":"Commercial signals and roadmap claims require different procurement gates.","kind":"recommendation","confidence":"high","evidence_ids":["e-crn","e-research"]},
    {"id":"c4","text":"Lightmatter specifies 6.4 Tbps each direction and Xsight specifies an 800 Gbps DPU; both are vendor specifications.","kind":"metric","confidence":"high","evidence_ids":["e-research"]},
    {"id":"c5","text":"Funding signals runway and conviction, not repeatable production performance.","kind":"interpretation","confidence":"high","evidence_ids":["e-research"]},
    {"id":"c6","text":"Buyers should run workload-matched, system-level evaluations across performance, power, software, reliability, supply, and lead time.","kind":"recommendation","confidence":"high","evidence_ids":["e-research"]}
  ],
  "slides":[
    {"slide_id":1,"archetype":"cover","action_title":"The race is fragmenting around four bottlenecks","audience_job":"Frame the market","claim_ids":["c1"],"evidence_ids":["e-crn"],"visual_ids":["v1"],"speaker_notes":{"talk_time_seconds":25,"narrative":"Introduce the buyer lens.","demo_fallback":null},"accessibility":{"reading_order":["title","subtitle"],"visual_alt_text":"Cover stating the four-bottleneck thesis."},"status":"built"},
    {"slide_id":2,"archetype":"executive-summary","action_title":"Do not evaluate these startups as one GPU-replacement race","audience_job":"Get the answer","claim_ids":["c1","c3"],"evidence_ids":["e-crn","e-research"],"visual_ids":["v1"],"speaker_notes":{"talk_time_seconds":40,"narrative":"State the decision and two proof gates.","demo_fallback":null},"accessibility":{"reading_order":["title","BLUF","three cards"],"visual_alt_text":"Executive summary with situation, insight, and action."},"status":"built"},
    {"slide_id":3,"archetype":"kpi","action_title":"A $1.3T market makes bottleneck relief commercially valuable","audience_job":"Size the context","claim_ids":["c1"],"evidence_ids":["e-crn"],"visual_ids":["v2"],"speaker_notes":{"talk_time_seconds":30,"narrative":"Explain the unit-of-value shift.","demo_fallback":null},"accessibility":{"reading_order":["title","metric","shift list"],"visual_alt_text":"Forecast metric and four shifts in buyer value."},"status":"built"},
    {"slide_id":4,"archetype":"four-quadrant","action_title":"Four architectural bets explain the ten-company field","audience_job":"Understand the landscape","claim_ids":["c1"],"evidence_ids":["e-crn","e-research"],"visual_ids":["v3"],"speaker_notes":{"talk_time_seconds":45,"narrative":"Map the companies to four overlapping bets.","demo_fallback":null},"accessibility":{"reading_order":["title","four bets","overlap note"],"visual_alt_text":"Four-bet company map."},"status":"built"},
    {"slide_id":5,"archetype":"comparison","action_title":"Inference specialists trade generality for latency and efficiency","audience_job":"Compare inference bets","claim_ids":["c1"],"evidence_ids":["e-research"],"visual_ids":["v3"],"speaker_notes":{"talk_time_seconds":40,"narrative":"Contrast five specialization approaches.","demo_fallback":null},"accessibility":{"reading_order":["title","company rows","trade-off"],"visual_alt_text":"Five-row inference-specialist comparison."},"status":"built"},
    {"slide_id":6,"archetype":"kpi","action_title":"Three companies monetize the cost of idle compute","audience_job":"See interconnect proof points","claim_ids":["c2","c4"],"evidence_ids":["e-research"],"visual_ids":["v2"],"speaker_notes":{"talk_time_seconds":35,"narrative":"Explain bandwidth and fabric bottlenecks.","demo_fallback":null},"accessibility":{"reading_order":["title","three metrics","caveat"],"visual_alt_text":"Three interconnect metric cards."},"status":"built"},
    {"slide_id":7,"archetype":"comparison","action_title":"Openness is becoming a distribution strategy—not an ideology","audience_job":"Understand open-architecture trade-offs","claim_ids":["c1"],"evidence_ids":["e-research"],"visual_ids":["v3"],"speaker_notes":{"talk_time_seconds":35,"narrative":"Contrast Tenstorrent and NextSilicon.","demo_fallback":null},"accessibility":{"reading_order":["title","company cards","trade-offs"],"visual_alt_text":"Open-architecture comparison."},"status":"built"},
    {"slide_id":8,"archetype":"process","action_title":"The commercial unit is expanding from chip to rack outcome","audience_job":"See the system shift","claim_ids":["c2"],"evidence_ids":["e-research"],"visual_ids":["v3"],"speaker_notes":{"talk_time_seconds":35,"narrative":"Trace the system value chain.","demo_fallback":null},"accessibility":{"reading_order":["title","five stages","company list","implication"],"visual_alt_text":"Five-stage path from silicon to rack deployment."},"status":"built"},
    {"slide_id":9,"archetype":"comparison","action_title":"Commercial evidence divides the field into two procurement gates","audience_job":"Separate current signals from roadmaps","claim_ids":["c3"],"evidence_ids":["e-crn","e-research"],"visual_ids":["v3"],"speaker_notes":{"talk_time_seconds":45,"narrative":"Use different proof thresholds.","demo_fallback":null},"accessibility":{"reading_order":["title","current signals","roadmap proof","qualification note"],"visual_alt_text":"Two-column commercial-maturity comparison."},"status":"built"},
    {"slide_id":10,"archetype":"kpi","action_title":"Funding buys runway—not production proof","audience_job":"Interpret capital correctly","claim_ids":["c5"],"evidence_ids":["e-research"],"visual_ids":["v2"],"speaker_notes":{"talk_time_seconds":30,"narrative":"Separate capital, silicon, and system evidence.","demo_fallback":null},"accessibility":{"reading_order":["title","funding metric","three proof levels"],"visual_alt_text":"Funding metric with three proof levels."},"status":"built"},
    {"slide_id":11,"archetype":"comparison","action_title":"Specialization creates the highest upside—and the sharpest roadmap risk","audience_job":"Assess strategic risk","claim_ids":["c5"],"evidence_ids":["e-research"],"visual_ids":["v3"],"speaker_notes":{"talk_time_seconds":40,"narrative":"Balance efficiency against drift and execution.","demo_fallback":null},"accessibility":{"reading_order":["title","spectrum","three risks"],"visual_alt_text":"Specialization spectrum with three risk cards."},"status":"built"},
    {"slide_id":12,"archetype":"decision-scorecard","action_title":"Use one workload-matched scorecard before advancing any vendor","audience_job":"Operationalize evaluation","claim_ids":["c6"],"evidence_ids":["e-research"],"visual_ids":["v3"],"speaker_notes":{"talk_time_seconds":45,"narrative":"Apply six system-level criteria.","demo_fallback":null},"accessibility":{"reading_order":["title","six criteria","gate rule"],"visual_alt_text":"Six-criterion vendor evaluation scorecard."},"status":"built"},
    {"slide_id":13,"archetype":"recommendation-ask","action_title":"Buy bottleneck relief—not startup mythology","audience_job":"Commit to the evaluation approach","claim_ids":["c3","c6"],"evidence_ids":["e-crn","e-research"],"visual_ids":["v1"],"speaker_notes":{"talk_time_seconds":25,"narrative":"Close with the buyer decision.","demo_fallback":null},"accessibility":{"reading_order":["title","recommendation","citation"],"visual_alt_text":"Closing recommendation."},"status":"built"}
  ]
}
